{
  "envelope_version": "1.1",
  "dataset": "project_page",
  "dataset_version": "v1",
  "generated_at": "2026-10-23T05:57:30.060036+00:00",
  "produced_by": {
    "profile": "free",
    "fallback": true,
    "run_id": "0f8a5bad-75b4-4418-b62d-cc519975648f",
    "keystone_version": "0.1.0"
  },
  "window": {
    "start": "2025-10-01T00:00:00+00:00",
    "end": "2026-10-01T00:00:00+00:00",
    "periods": []
  },
  "sources": [
    {
      "name": "GH Archive",
      "url": "https://www.gharchive.org/"
    },
    {
      "name": "OSV",
      "url": "https://osv.dev/",
      "terms": "CC-BY 4.0 (osv.dev data license)"
    },
    {
      "name": "ecosyste.ms",
      "url": "https://ecosyste.ms/",
      "terms": "CC-BY-SA 4.0"
    }
  ],
  "privacy": {
    "level": "repository",
    "people": "aggregate-only"
  },
  "corrections": "https://github.com/azzammasood/keystone-pipeline/issues",
  "row_count": 0,
  "rows": [],
  "status": {
    "state": "partial data",
    "detail": "partial data: the rollup holds 0.1% of the window's hours; not scored"
  }
}
